{
 "schema": 2,
 "name": "choice_act2_nightsong",
 "title": "Act 2 choice: Shadowheart and the Nightsong",
 "about": "Choice (family 3, claude-run-2 quests.md, S041-S042): with Balthazar dead, Shadowheart stands before the Nightsong and her goddess demands its death. claude-run-2 spared it (Persuasion DC 14). The run ends when the journal closes the choice or a fight is won. The choice and the reason given are recorded and compared across models, never scored right or wrong; the goal only ends the run. Neutral brief (BENCHMARK-PLAN.md).",
 "family": "choice",
 "holdout": false,
 "start": {
  "kind": "save",
  "save": "Tav-18221265949__SCN-choice_act2_nightsong",
  "save_sha1": "be5f850108d7bf3df1509a8303e173b4185bd889",
  "note": {
   "where": "The Shadowfell, Nightsong's Prison, on the plateau before the Nightsong; out of combat, no dialogue open.",
   "objective": "Go to the Nightsong with Shadowheart.",
   "party": [
    "Tav (Paladin 6)",
    "Wyll (Warlock 6)",
    "Karlach (Barbarian 6)",
    "Shadowheart (Cleric 6)"
   ]
  }
 },
 "goal": {
  "any": [
   {
    "quest_done": "chosen of shar|daughter of darkness"
   },
   {
    "combats_won": {
     "gte": 1
    }
   }
  ]
 },
 "runs": 3,
 "caps": {
  "run_hours": 0.5,
  "max_cost": null,
  "max_tokens": null
 },
 "game_settings": {
  "difficulty": "Balanced",
  "karmic_dice": false,
  "seed": 1020,
  "resolution": null,
  "ui_scale": null,
  "language": null
 },
 "timing": "realtime",
 "requires": {
  "vision": false,
  "min_context": null
 },
 "conditions": [
  "rules"
 ],
 "profile": {
  "character": {
   "name": "Tav",
   "brief": "A half-elf paladin with a mind flayer tadpole behind the eyes. Their values are yours to decide: choose as you think this character would, and say why.",
   "roleplay": "light"
  }
 }
}
